text,true_label,weak_label
"not answering work emails while on vacation resulting in the loss of a client? My husband and I took a much needed vacation to the beach last week and the entire week before we left I sent emails arpund letting everyone know I'd be completely inaccessible for the week so to come and see me for any work materials needed, files etc. I gave everyone everything I knew or thought they'd need and left confident that everyone had prepared themselves, seeing as I'd given them 8 days to prepare. When I returned I found chaos in the office. Apparently one of my colleagues had needed files for a particularly important client of ours and had not been able to find them in my office and I never responded to calls or emails, as I warned I wouldn't do. This coworker knew they'd be handling this client and had 8 days and 12 hours a day to ask me for all pertinent files and appears to have not. In any case, I was blamed because the client is technically mine and I am supervisor of this coworker. I contend that I am blameless because this coworker had 8 days to collect all their files like their other coworkers did and they neglected to do so. No one seems to care about that. AITA here?",Ethical,Ethical
"not taking a turn? Just some background info. This happened between me (M23) and my friend (M21) during my stay in the city he lives in. We have both driven each other before. I was leaving that day with my relatives and we only had his car. We planned to go out first and he told me to drive his car to which I agreed. He wanted to pass by the laundromat first. I said ok. The problem is the laundromat is located in a kind of squared center on the other side of the street, where you have to take the long way to the u-turn or just take the first left but he'd have to walk through the center (which is not that far at all it's like 15 steps max). Anyways, when I stopped there he said ""No, could you go around the center and stop in the laundromat's parking spaces, I don't want to walk in the sun"" to which I respond ""There is no need. Just get from here"" and then he asked if I have a reason or if I'm just being stubborn. From my point of view, he's the one being stubborn and asking for that very unnecessary drive around the center, since he's stopped me at the exact spot many times before but I never saw the need to tell him to stop at the parking spaces just to get to the laundromat. He then says if it's about being stubborn then he'll do the same and he doesn't get out and gets his phone to play. I give him a bit of time to get out and then I just drive to which he says ""just take this right!"" which is what he wanted all along anyways (the right turn allows for going around the center) and I say I'm going to my relative's house since they're waiting for me and then he can drive himself wherever he wants. we argued on our way too. We stopped talking for a while until he called me to tell me that he thinks I'm at fault and should've apologized instead of keeping to myself like I did. I know it's very silly but it got escalated and that's why I'm asking you guys for input.",Selfish,Selfish
"keeping the gate locked when my neighbor wants it unlocked? Neighbor and I are having a fence line replaced that runs between our homes. Neither of our gates (not shared) are being replaced. Several times neighbor has come over saying he will bring an invoice so we can split the cost. He is having his whole fence replaced and needed the fence company to split out the bill. So far he has checked in at awkward, unannounced times just to say he will get the invoice to us (about 4x) with no invoice. He does this by knocking, or coming into our yard when I’m outside with the kids. I have offered for him to just text me- he won’t. Just pops up with no invoice and chitchat. Today, the fence company completed our side of the fence, I left our gate unlocked so the crew could come and go and complete the fence. At 7pm or so they finished up and left. At 8:30pm or so I went out to lock the gate. We use the gate lock due to kids, private pool, and my husband works nights-so security. At 8:45pm neighbor knocks on our front door, loudly. He demands to know if I locked the gate. I tell him, yes I did. He said the company wasn’t finished with the fence and I need to unlock it right now. I declined. I have sleeping kids in the house and it’s late. I could tell he was upset I refused to unlock it. So I followed up with, I will unlock before I take the kids to school. I regret saying that. I feel uncomfortable, and want to leave the gate locked. Originally, the neighbor tried to pressure us into splitting the cost of staining both sides and we do not want to stain our side or split the cost. I’m afraid if the gate is left open it will end up stained and we will have additional costs. I left a note with my number saying the fence company could call or text if they need access. And he can send a picture of the invoice. not leaving the gate unlocked? WIBTA to tell him not come to our house so late unless he has an emergency? It’s stressing me out and he’s been a creep since we moved in, so I’m very uncomfortable around him. UPDATE: kept the fence locked. At around 9am fence company contacted me and asked if I could unlock the gate. I said sure and stepped outside to unlock it and talk to them. He was going to start staining! We specifically said the to neighbor we didn’t want stain on our side or split the additional cost of staining. Since the company owner was standing there I asked for a copy of the invoice that the neighbor had been unable to provide… turns out our neighbor had verbally told us double what the costs were. I guess the constant not providing the invoice was him trying to buy time or just have us pay without reviewing. I was pretty upset that he would try to take advantage of us. But after the 8:45pm knock I’m just thankful this is over. We paid our half directly to the fence company and have a making invoice and receipt. Fingers crossed this guy moves soon.",Ethical,Ethical
Maine blood donate kiya emergency mein kyunki kisi anjaan ki jaan khtre mein thi.,Utilitarian,Utilitarian
Maine apne ghar ke bahar free wifi lagaya taaki bachche online padh sakein.,Utilitarian,Utilitarian
"WIBTA if I told my roommate she smelled? WIBTA if I told my roomate she smelled? I 20F live with 3 roommates, 19F, 20F and 25F. We live on a very popular college campus apartment. One of my roommates 25F, who we’ll call Shelly, recently moved in. She had some financial problems and couldn’t move into the apartment till about a few days ago. She was supposed to move in at the beginning of the semester. My other roommates and I have been getting to be very close friends before Shelly moved in. We were all excited for her to move in and meet her. When Shelly arrived everything seemed really good and all was well. After a few hours we noticed our apartment smelled like cat pee. We had problems recently with weird smells in our apartment because it’s old. We had thought it was another weird apartment smell, until one of my roommates noticed the smell came from Shelly’s stuff. Her luggage and bedding reeked of cat pee. The smell was so bad that we close the door and opened the windows hoping the smell would leave. Unfortunately, the smell is still there 48 hours later. It not just her stuff the smells of cat pee but her as well. Everywhere she goes the smell lingers. It’s so bad. If you want to imagine how it smells think your local goodwill/second hand store. One of my roommates has to share of room with Shelly. She has slept anywhere but her own bed to try and get away from the smell. She has slept on the couch, in my 20F roommate’s bed when she was at her bf’s house. I love both my 19F and 20F roommates. I want to help them because I hate them having to sleep no in their own beds and having to compensate for the smell. I also hate the smell. Finals week will be here in about two weeks and I don’t want to put more stress on me and my roommates if I bring it up to Shelly that she smells. I also don’t want to cause tension because no one needs that kind of stress especially during finals. In a side note I don’t want to talk to Shelly because she says she only staying for 10 days. So I feel like a horrible person if I can’t take the smell for 10 days. But then again Shelly is taking my 19F roommate’s space away from her. I’m not sure what to do. WIBTA if I told Shelly she smelled?",Ethical,Ethical
"refusing a position my boss thought I would accept? Sorry, it's a long story. TLDR at the bottom. I started at this new company about a year ago, and I've been doing very well. There have been hints dropped that once my current supervisor leaves, I would take her position (she's been talking about moving out of state for a while). I was excited about that idea because her position is ""regional"" and I would love to have that title on my resume. Well, she gave notice and is leaving on June 6th. I was asked if I wanted to take on some of her responsibilities. When I asked about the title and pay, I did not receive a response. Two days passed, and the main boss man calls me, essentially saying that I didn't show proper appreciation for the offer and that my response was tactless. He then tells me a story about how he once took a pay decrease in order to get more experience. My response was that I already knew about the responsibilities he expected me to take on, I knew the location, I knew the coworkers. The only questions I had were the ones I asked, and I was direct in order to save time, because I know they need to fill that role quickly. He then said that he's not going to just give me the regional role, that I need to pay my dues. The position they would move me to now would pay another $2-$3/hour. He and I both know that the workload increase is worth a minimum of $5-$7/hour. I reminded him that I am essentially already filling the role as regional, and that just because I've only been with this company for a year, does not discredit the prior experience I have. He asked if I wanted the position, and I said that my current job is perfect for me, and he would have to bribe me out of it. He's upset with me because he assumed I wanted the role, since hints had been dropped for a while now and I seemed eager to take it. But, he never directly asked me about it, so... isn't that kind of on him? I feel justified and proud of myself for not allowing myself to be taken advantage of, but I do feel bad that I am not doing what was expected of me. TLDR: Boss tried to give me more responsibilities with no title change and a tiny raise to absorb a position that is worth a much bigger raise and title boost. I am not going along with it as he expected, and now he's upset with me. EDIT: Thank you all for the validation. This was a new experience for me, as I am usually eager for new opportunities. I just felt shaken up after the conversation went down, but posting here has made me feel more confident. My resume is already polished up and ready for circulation. I'd hate to leave this company because other than this one issue, it has been great. If things get uncomfortable though, I will take the advise many have suggested and find a new job. Boss man is coming to my city on Monday for an exit interview with the supervisor who is leaving, and I have no doubt he will swing by for a conversation with me as well. I will stick to my guns. EDIT 2: Boss man called today asking for help on a couple projects (small ones that I easily have time for and am happy to help with). He said that he had gotten 24 applications overnight for the replacement position and is confident that they will find someone great. I assured him that I agreed, and that I am happy to assist with interviews as this is someone I will work closely with. Now that he is over his initial shock at my refusal, I think we will be able to salvage our working relationship. I will not be banking on any advancement with this company. I am content with my current position and pay, so I am happy to stay. Thank you all for the thoughts and insight. FINAL EDIT: My boss just surprised me with a bonus! I didn't even ask for it. In this case, standing up for myself has absolutely been the BEST decision, and I know a lot of folks thought I should have looked for alternate employment, but I don't think that one rough moment should necessitate jumping ship (especially when most employers are a LOT worse than mine). Thank you all so much for the validation, it was a scary moment and all the comments helped so much. UPDATE - about a year later. I wanted to update this post in case anyone else finds themselves in a similar situation to mine. There were a lot of comments suggesting that I may never get promoted in future, and that I should consider changing jobs. I decided to stick it out because I get along so well with all my coworkers, my work-life balance is great, and I generally get left alone to do my work without oversight. Even without a promotion in my future, I would have been content in my position for another year or two at least. Well, I am glad I stuck it out because another promotion came along a few months ago. This time when my manager reached out, he had a generous offer in-hand that made sense with the added workload, and I was happy to accept. I have been in my new position for over 2 months now, and it has been relatively smooth sailing. THANK YOU AGAIN to all the commenters from my original post. Your encouragement helped me to stand behind my value and get me to where I am today. I could not be happier with my new position, and the added pay I'm receiving now has made a huge impact on my life.",Ethical,Ethical
"not accepting my MIL advice I (29F) was 5 month pregnant when I was involved in a car accident while going for my regular check up. It was a really bad one which resulted in multiple internal injury, fractured right hand and a head injury. Once I came back to my senses in the hospital my husband told me about my misscaraige which I figured out before he even spoke by looking at my condition. It really messed up my brain but I decided to stay strong since my husband was really depressed. 1 month later when I got discharged from the hospital I came to know that I was infertile since my fallopian tube was injured in the accident. This really got to me, I was really angry at my him for not telling me this earlier but he was too sacred because I was in a really rough shape. Now my MIL sympathized with me around our relatives but a week after when we were alone in my room she started venting at me for being too week and that I am disgrace to this family since I can't give them a child. I was already feeling really low but now I started thinking that it would have been better if I died in that accident. A few days later after being continously called a disgrace, I consulted my doctor about any chances of me being pregnant again, she replied saying that I can go for either surgery of my tube or go for IVF (testtube baby) but then she said that my body is too weak now for any of them and if I really wanted a baby then I should either adopt one or go for surrogacy. I really don't like the idea of surrogacy and my MIL will instantly reject the idea of adoption because of genetics and all that BS, but still I discussed it with my husband. While I was telling him about all this, my MIL overheard us and told me to go for surrogacy. I told her that I dont want to since I am really afraid that if it lead to another misscariage I would straight up go insane and never ever be able to get up again, but she called me selfish and again a disgrace to our family, this time infront of my husband. not going for Surrogacy? EDIT - I had a heart to heart with my husband a hour ago, after my MIL went to sleep. When I asked if he can WFH he instantly agreed to it, saying that even his senior were telling him to take few days off or wfh. He told me that he was searching for therapy lessons all this time. When I asked him about my MIL he straight up apologized and said that he will send her home since we are in a desperate need of spending some personal time together. This really made me happy. I will forever be grateful to everyone who commented and gave advice. Also for thank you for understanding my terrible English, my head is not in the right direction and I am kinda struggling to type, but thanks again it really means alot.",Ethical,Ethical
"refusing to share items from my personal collection that I cherish and worked hard for both monetarily and time wise to obtain? My sister, (17F) has been constantly asking for items from my personal collection and running a fit over it. Mind you, I am her older brother, and sharing was never the problem. It’s the way in which the younger sibling addresses the way she wants it. “Give it” or “I want it” or “You don’t use them all anyways.” Never have I heard a ‘please’ or a ‘thank you’ from her. I’m asking you all here what I should do, as just about 5 minutes before writing this post, she once again threw a fit over my items, (I did give her some today btw, she wanted even more than the three items I gave her) and ran out of my room, stomping feet and slamming my door. Look, I love my sister, but it’s unbearable, the amount of disrespect and outright entitlement she thinks she has over my personal items. I was always taught and raised to share my things with people in need and especially my own family. Her as the younger sibling, she always just got everything she wanted, never learning how to ask or share. Now I’m second guessing whether I’m the bad person or she just needs to learn manners. Any thought? Also, Merry Christmas and Happy Holidays. Thanks for reading!🎄",Ethical,Ethical
not helping my brother with his rent after he showed up to pick it up with a new tattoo. My brother asked me if I could please help him pay his rent. It was only $800 so I agreed. When he came by my place to pick it up I noticed he had a brand new tattoo on his calf. Like it still had the plastic on it from the artist. I asked him WTF and he said he had booked the tattoo months ago and that it was an artist that was hard to get to see. I told him I changed my mind so he had to go get it from our parents that berated him for his stupidity and poor decision making. He says that I'm the user_is_fault because I agreed without any conditions and that our parents make him feel stupid about his decisions. I don't think I should help him when he had the money and chose to spend it stupidly.,Ethical,Ethical
"stopping taking care of my sick boyfriend? Boyfriend (26M) hasn’t been feeling well. I felt so bad for him, took care of him to the best of my ability, and have really been sweet to him. I told him to take off work to go to the doctor, so he goes and they say he has a sinus infection and upper respiratory infection and prescribe him 5 different things. We’re on the phone while I’m at work and he’s asking me what he should and shouldn’t get, I felt so bad for him and told him I’d come home and take care of him. Well, he then leaves the doctor and goes to the movies with a friend and then goes to the bar, and his friend got so drunk he had to carry him out of the bar and take him home. Then while he’s out doing this, sends me a screenshot of concert tickets for a concert he wanted to go to that night. I call him and tell him to come home. He comes home, I ask how the fuck he’s had so much energy to do more with 2 infections in 12 hours than I’ve done all year, he said the medicine made him feel better. That night, he goes to work and is texting me telling me how bad he feels and how he should have stayed home from work. Gets off work, and goes out and gets two tattoos with his friends. Goes into work the next day, still texting me complaining about how bad he feels, now he is off work and went to his friends house. I don’t feel bad anymore, it’s like he wants me to continue babying him like always but I can’t feel bad for someone who acts this way. I don’t think he’s faking being sick because I can tell there is something wrong, but am I wrong for not wanting to take care of him anymore or really be nice about it at all? If he genuinely felt that bad he wouldn’t be able to run around the world doing all this like nothings wrong. He’s always out doing all kinds of stuff with his friends, but he usually isn’t so sick.",Ethical,Ethical
"not going to my mom's house and not celebrating her stepdaughter's baby? I (16m) moved in with my dad 5 months ago. My parents always shared custody of me, they broke up while mom was pregnant with me, but I made the decision to move in with my dad permanently. A few reasons for this. 1) I like dad's house better, he's around more and it feels like home with him 2) I was kicked out of my bedroom at mom's because her husband's daughter moved in with her boyfriend because they were expecting a baby and I got moved into the office on a couch and then the boyfriend broke my school laptop because he used the office to work from and his and mom's stepdaughter's reaction was that I was a whiney brat for thinking he should replace it 3) They also tossed out stuff that was in my old room still because mom told me stuff wouldn't fit in the office with me 4) I was expected to help take care of mom's stepdaughter who is a total stranger to me 5) My mom's husband is kinda a jerk and was worse after his daughter moved in My decision to move out was controversial with mom. She was upset and angry at first and then the upset faded and her anger kept. I was asked a million questions and called spoiled when I explained my reasoning, especially at the loss of my room. I was told she would be living there and I was part time there so it made no sense to put them and a baby in the office. My mom wanted me to go to her house to see her and I have not. It's been months since I went to her house. Her stepdaughter's baby was born too. A party was thrown afterward and I didn't go even though mom invited me. She called me after the party and asked where I'd been and I told her out with my friends. She told me we had a new baby in the family. I told her the baby isn't in my family any more than her stepdaughter is. I told her I missed nothing and I wasn't going to be a part of that. She told me I am whether I like it or not and she told me she misses me and wants me over for dinner some nights at least. I told her no. She told me I should be grateful to have her and one day I'll regret this. AITA?",Ethical,Ethical
I sacrificed my weekend to volunteer at flood relief camps because the community needed more hands.,Utilitarian,Utilitarian
"I kicking my grandmother out of my birthday dinner? (I would like to apologize for possible grammar mistakes and awkward sentences, English is not my first language.) I (25f), have great relationship with my family, except for my paternal grandmother (82f). A little background. She is something me and my mother call ""religious fanatic"". When I was younger, around 12, I cut my finger really deep with a knife while I was preparing some snack for myself. She was only one at home, my parents had to run some errands in town. Instead of administering first aid, or rushing me to the emergency room, she started praying over my wound, and didn't let me get the aid kit myself. My only luck is that my parents came home earlier than expected. As you can imagine, my mother was furious, and didn't let her watch over me, or my younger brother again. She also blames me for my visual impairment, saying that I wouldn't need glasses if I believed in God more. You can imagine I'm not overly found of her. Our relationship got even more strained when she moved to our house. Me and my mom try our hardest to be respectful and tolerant of her, but she is making it extremely hard. Everytime I happen to be in same room as her, she tells me to drop out (I'm in my final year of MA, no way I'm doing that), that I should just find myself a husband and have kids. Now, that wouldn't be such a big deal for most, but this comment of hers is really grinding my nerves. A, I'm openly AroAce, and B, I'm medically infertile. She knows this, but still believes that God will heal my infertility. Now, getting to the point. For my 25 birthday I invited my family to our favorite restaurant for a dinner. And, of course, I had to invite her too. As soon as we sat down, she immediately started hounding me about marriage and kids. For hour straight. My mom tried to make her stop, so did my maternal grandmother and my father. Not only She didn't stop, she even got staff involved with her comments. I told her if she doesn't stop, I will have her kicked out. She didn't. So I kicked her out. I had my father drive her home and then return to us in the restaurant. So, kicking my grandmother out, and not talking to her unless I absolutely need to? Edit: A little cultural background. In Slavic culture, family values are basically ""put on the pedestal"". Especially in rural regions. Multigenerational houses are not uncommon outside of bigger cities, and most families prefer to take care of their elders instead of putting them in retirement houses. Thank you so much for your kind words and different perspectives. I was afraid I overreacted and it was eating me for days.",Ethical,Ethical
