text,true_label,weak_label
"not letting my 16yo daughter have my 10yo son's room? We are in the process of moving into a new home. The house is more spacious then the old one but has limited rooms. It only has 3 rooms. My wife and I have 3 daughters 16yo/14yo/12yo and one son 10yo. The problem that's been tearing the family apart right now is that my 16yo daughter is refusing to share a room with her 2 sisters, She wants her 10yo brother's room. Her argument is that her brother is too young to have his own room and that she deserves more privacy and space since she's the eldest. Thing is we, as a family always give the boys their own rooms no matter the age while the girls share a room together. This method has proven to be workig cause girls naturally share while boys don't and they fight a lot. My daughter threw a rage fit and got my wife involved. My wife called me unreasonable for thinking it's fair to make the 3 girls share one room while our son gets an entire room for himself, and he's the youngest!! So he's the one with the ""least"" privacy. I told her that it's been like this for years and just cause we're moving into a new home doesn't mean things have to change, to be honest part of me is thinking that my 16yo is doing this simply because she's against the idea of moving in the first place and is looking for excuses to not move in to the new home, my wife argued that moving our 12yo daughter with our 10yo is the best compromise, but my son won't accept this and I already know that. all I'm looking for is for everyone to be happy and comfortable and to my understanding, my daughter was fine with sharing a room with her sisters then, why Change her mind now?. My wife still sided with her and said that I should be careful because the girls are beginning to sense some sort of favoritism towards my son which isn't true at all. but it's all about what we're used to and what is the norm in the family, They're both not speaking to me and are acting somewhat hostile towards me. ETA for those who are saying I was in the wrong for buying a 3bedroom house, well our financial situation isn't the best right with everything happening in the world and real-estate prices getting higher and whatnot. Also, those who are saying I'm favoring my son, I'm not, I treat him the same as his sisters in pretty much everything and I 100% guarantee it, I accept my verdict nonetheless but still wanted to make few points clear. Thanks anyway.",Selfish,Selfish
"telling my SIL she should be ashamed of herself and learn to be a mature adult? My brother had two kids with his ex by the time he was 21. He stuck around for a couple of years but when they broke up he left the kids too. He paid no child support, made no effort to keep in touch with the kids, did not check if they were okay, nothing. The rest of my family let the relationship drop too but I (38m) was the exception. I stayed part of my niece and nephew's lives. I still have a good relationship with them today and they're close to my kids. Five years ago my brother got married and now he's expecting baby #3 with his wife. After settling into family life he started to think more about his oldest two and he made the decision to reach out to them. He was met with silence initially and then after speaking to his ex, he got a brief message from his kids that they were still mad and hurt that he left. They had contact for about a month and it was sporadic. He asked if they could meet in person and the kids said no. But they said they would do a video call with him one time and that was it. This call happened 2.5 months into their ""reconciliation"". At some point during this he mentioned wanting them to meet his wife and other kids. They told him that was not going to happen and they didn't want to reconcile with him. My brother was surprised, he had thought that them opening up to him about being angry and hurt was a sign that they were willing to work through that. They told him it would be one thing if he hadn't settled down and started a family all over again but the fact he did that and then reached out to them was too much for them and they want nothing to do with the family he created now. This led to a back and forth where he said they have younger siblings and they told him very clearly they will never acknowledge or accept them as siblings and they will never accept him as their dad and he needs to move on. I spoke to my niece and nephew after the call, they reach out to me, and they said it was good to close that door and to have the decision be their own. They felt like they got closure. My brother wasn't prepared for the outcome and his wife is furious that my niece and nephew rejected them for existing. She started badmouthing the kids at my parents house in front of all of us. My brother told her to stop. But she told him they should be ashamed of themselves for reacting like spoiled brats who don't get their way and punishing innocent children when they're supposed to be grown adults now. I told SIL she should be ashamed of herself for talking like that about the kids my brother abandoned and didn't give a second thought to until he had settled down with her and their kids. I told her she should learn to be a mature adult and accept that his actions had consequences and this is one of them. Cue her being offended and saying I have no right to speak to her that way and some of my family telling me I should have said nothing. AITA?",Ethical,Ethical
"throwing out my roommates non-vegan food? When my girlfriend and I put out advertisements for a roommate we specified that we keep a strict vegan house - no exceptions. This meant no meat in the house, no dairy, no eggs, not even honey. We were very clear on this and outright said another vegan would be ideal. And that actually worked out pretty smoothly! A girl we'll call Jessica moved in and things went along swimmingly for the past three years. Jessica was also an ethical vegan and there was no fuss over food, no drama, everything was peaceful and we all were pleased with the arrangement. Enter Jessica's new boyfriend, Charlie. Charlie absolutely does NOT agree with veganism. Ever since an incident where he drunkenly tried to store a bunch of half eaten sausages in our fridge and I told him he wasn't keeping that shit in our house, he's had a big problem with me. Whenever he comes over he'll make snide little comments about our little vegan decontamination zone, and loudly talk about how much he loves meat and all the the meat he recently ate. To sum up how childish he is, he went as far as to ask if he was allowed to take a non-vegan shit in our toilet in front of a bunch my guests my girlfriend and I were hosting which was completely embarrassing for everyone. He's a complete dickhead, but that isn't what the main issue is. I figured Jessica wouldn't put up with Charlie for long given how he behaves, but not only has that not happened, he's talked her out of veganism entirely. When Jessica let me know that she was no longer vegan, I told her as long as she didn't store it in the house, it was fine. Seeing her bring meat takeout into our house to eat was upsetting, I won't lie, especially given Charlie would often be grinning like a rat during the entire ordeal. Not to mention the smell. Emboldened by Charlie, she's started to store non-vegan food in our fridge. First it was butter and some liquid egg whites, which my girlfriend begged me not to start something over given how tense things had gotten, but earlier today I came home and found multiple packets of bacon taking up nearly an entire shelf of the fridge. I gathered them up in a trash bag alongside the butter and other stuff that had built up and just tossed it all in the bin outside. When Jessica returned and saw it was all gone a shouting match broke out and now she's claiming I can't force her to keep a vegan fridge, and our agreement meant nothing at all. I told her perhaps it was better she find another house to rent at, and she called me a controlling dick. I don't think I'm being controlling GIVEN THIS AGREEMENT WAS CLEARLY SPECIFIED. It wasn't a hidden clause, it wasn't something I sprung on her. In my opinion Jessica and Charlie are both behaving like absolute fucknuggets, but when I vented to my brother he said that I was actually being a dick in this situation. So I come to you, reddit. Whose the actual user_is_fault in this situation?",Selfish,Selfish
"telling my sister she isn’t the type of person I want my daughters to look up to My sister and I are complete opposite. My sister doesn’t have many accomplishments and the last thing I remember her achieving is graduating highschool. At 20 she dropped out of college because she was pregnant. She moved in with the father and for 10 years they were a family. All that time she didn’t had a job even when her son started school. Those two never married and he left her about two years ago. She is now pregnant again, ( new dad isn’t involved) works at fast food and barely scraps by. She is constantly asking for money. She actually wanted to move in with me and my kids. My wife travels a lot. I have two daughters and my sister told me she wanted to be closer. She wanted to move in to my home, that it would be good for the girls to have a women they could look up to ( she never liked that my wife travels ) This isn’t the first time she has brought it up and I have turned her down politely many times. My sister brought it up again last night. I told her no. This resulted in a heated conversation with her asking why. I decided to be honest and I told her that she isn’t the type of women I want my kids to look up to. I also listed the reasons above. She called me a jerk The family is now on my ass about this, saying I was heartless to tell her that. They also want me to apologize. AITA?",Ethical,Ethical
"supporting my daughter's sports preference against her mom's opinion? I just had a fight with my ex-wife, who I unfortunately still live with until we sell our house, over sports. Our daughter is 12 very soon, she's 5'2 and skinny and entering 6th grade. She has celiacs, so diet and nutrition are a concern and we've been working for a couple years to get her weight up and she actually had an appointment today with her GI and they were really happy with her weight gain and said she doesn't need to be seen every 6 months anymore. But she is a healthy, tall, beautiful, amazing kid and she plays rough. This evening we were talking to her about picking sports. She's been playing girls soccer off and on through different recs for a few years but she's not great at it and she wanted to try something new. She was interested immediately in girls volleyball because her PE teacher had told her she was good at it and we also both think she would be fantastic at it. However she asked what crosscountry was and when I explained it she was really interested in that and wanted to do that. My ex immediately became adamant that she could not do CC. She said that CC requires a specific diet and because my daughter is a picky eater and already has celiacs she was afraid it would be bad for her health because she wouldn't keep up with the carbs and that it was bad for her joints. This upset my daughter because she is very sensitive about the things that she is prevented from doing because of her celiacs and started crying. Then my ex brought up that running and high impact running can affect periods and that my daughter is showing signs of starting her period soon and she doesn't want that to be rough for her or be delayed because of running. I had a really hard time understanding the logic of this. Despite this and trying to keep the peace I tried to help my daughter come around by suggesting that I think she would be really great at VB and she's also interested in VB so maybe she should just do that, and try track in the spring instead. That pissed off my ex again saying that no she feels very strongly that it wouldn't be good for her health to be in a running sport and then of them kept arguing. She said you can play soccer or volleyball or whatever but I don't want you doing cross country or track. I made the comment ""you know a soccer player on average runs more than 2 miles in a game, same as CC"". She flipped out and yelled about me trying to get my way and stormed out. I went and talked to her and we argued. I told her she was being manipulative and hurting our dhtrs feelings by bringing up celiacs and that it was completely illogical that she couldn't do CC if she could do the other sports and that other girls can play all these sports. She was upset and crying and wanted me to leave so I left. She says I undermined her,, but I think that I did my best to convince my daughter to go along with what her mom said but when my daughter still wanted to do it I couldn't just back her mom up because it didn't make sense to me.",Ethical,Ethical
"not accepting my nephews apology So my nephew (11) stayed at my house for a few days and this morning while I was at work I received a few emails from PlayStation thanking my for my purchase. So I immediately sent my wife a message telling her what happened and that he needs to get off of the PlayStation. So I get home from work and I'm obviously pissed off. My wife and I live paycheck to paycheck and he spent 30 dollars on fortnite. After 10 minutes of his mum telling him he needs to apologise he finally did with a weak ""Sorry"" so I told him. ""I don't accept your apology. You're not sorry because you did it you're only sorry because you got in trouble for it."" My wife told me that I'm an user_is_fault and I've ruined her relationship with them and if I ever do that to out kids then she will leave me. EDIT. not sure if it makes a difference but to the people telling me to make him work it off it's only 30 dollars. He was meant to be getting picked up today before I got home from work. Which is why I'm assuming he decided that it would be fine to do. And not everyone has a spare 30 dollars. I get a free sandwich at work every day which carries me through to dinner. 30 dollars is a lot to me. EDIT 2. I was not reimbursed in any way. EDIT 3. He purchased 2 lots of V bucks with my dedit card. Sony doesn't do refunds on that.",Ethical,Ethical
"refusing to eat all of my wife's food? So I (37m) and my wife (35f) are cooling down from an argument right now based around me telling her point blank to make less food in the future or I'm going to continue not eating it. The backstory is pretty simple and nothing to the point of threatening our marriage or anything. I'm getting up in years and as a basketball player and these knees are startng to go. I had eventually reached around 89kg (196lbs) at 176cm (5'9) tall around the tail end of Covid. I knew I had to make a change and at least get down to my pre-Covid weight (around 74kg, or 163lbs). Now I'm actually all the way down to 70kg! I'm happy with my progress and I'm set on making this my new normal moving forward until old age and beyond. But my wife isn't exactly thrilled I've shed all the weight. There aren't love handles for her to play with anymore. Most devastating for her is I don't eat nearly as much as I used to. We trade off cooking duties every day and when it's me, I usually make just enough. But when she cooks? There is always enough food for another full plate of food. My wife is tiny so she can't eat it, and I'm now a dude who doesn't eat it, either. I always say we can save it and have it for dinner the next day again (I don't eat breakfast and lunches are provided by my work), and while that worked for awhile eventually the leftovers just went in the bin and she'd ask me to cook something new instead. Although it's been fine more or less she doesn't hold back on commenting. To her, men should be eating seconds or thirds. It's just the Japanese way to her (she's Japanese and we live in the country), and she always recalled her father enthusiastically asking for seconds and thirds. She's feeling more and more ashamed that her husband doesn't like her cooking. But I do! Her cooking is fantastic. And I eat as much as I can when she makes it! It's just she makes too much now. We've had talks about her portion sizing, but it's always gotten back around to letting her cook her way. This all boiled over earlier tonight when she asked if I wanted a second serving of karaage (a delicious fried chicken) and I said, ""Nah, I'm way too full."" In which she countered with, ""Are you just going to throw away all this chicken then? That's so wasteful."" I knew I was giving the wrong response immediately, as the words left my mouth, but still I said it. ""YOU are wasting all of this chicken. I told you to make less food. I've been telling you for months. I don't see you eating the chicken, either. You are the one wasting money and time making all this extra food that I won't eat, and that's not going to change."" Now she's in bed after a cry, and nothing from me gave her any comfort. And I'm downstairs writing this. I know my response was wrong in the moment, but have I been an user_is_fault about this entire weight loss journey, at least as it pertains to my wife's cooking? Should I have just sucked it up and ate all of her food?",Ethical,Ethical
"not telling my friends about our mutual friends' wedding? I have a group of friends, myself, Derek, Nicole, Jessica, and Ben (all early 30s). We all met doing a mutual hobby in college, and we've done things just the 5 of us ever since. A few weeks ago, Jess and Ben eloped. I knew about their plans to elope about a month before it happened because I helped with some travel related plans (destination elopement), and they let me know it was only going to be them and their parents. In the month leading up to the event, I asked them if they were planning on telling Derek and Nicole. They agreed they would be telling them. Well the weeks came and went, Jess and Ben eloped and Derek and Nicole were never told. This afternoon, Jess and Ben dropped the news to the three of us that they got married, and showed us some sneak peek photos. I pretended I was just hearing about this for the first time, but Jess let it slip I had gone to the dress fitting with her, and I could tell that Nicole and Derek were hurt by this information. I've reached out to both of them to ask about how they felt and neither has responded. I'm feeling pretty bad about not telling them, and also like I've been put in the middle of a potential conflict I didn't ask for. It didn't feel like my place to say anything about the wedding, but I feel like I'm at fault for not giving them a heads up, or even more at fault for pretending I wasn't aware during the ""announcement."" not telling my friends about the wedding? TLDR : 2 friends got married and only told me in our small friend group. Should I have told the rest of the group? Edit: thanks for the comments everyone. it did make my guilt lighten up. I did hear back from Nicole and Derek. They’re both happy for Jess and Ben and understand that things happen quickly with eloping. I apologized for not feeling comfortable telling them myself and they reiterated what a lot of you said. it wasn’t my place to tell.",Ethical,Ethical
"wanting christmas woth my family not to be cut short because of my boyfriends family Been together for 2 years For context, i went to florida for a week with his family to spend Thanksgiving with them. My family is small and only gets together maybe 3 times a year while his are together all the time. The deal we made was that if i went to Thanksgiving with his family, we needed to start seeing my family once a week sense im staying with him and his family. Also that we would do christmas Eve afternoon with my family and christmas morning with my parents. I spoke to his mom and sister about it, and they said they were making plans for the week after Christmas. And said that it would be fine because they did christmas dinner with everyone and then breakfast christmas eve so it was perfect. Well now him and his family are freaking out on me because i dont have a time frame when i get back other then before the afternoon and they are all of a sudden changing plans and wanting to do stuff right when we need to be with my family. His mom also bringing up the idea that i need to leave my family by 10 to make it with his family and leave my grandmothers after being there for 3 hours to spend the whole morning and night with this family ao we can drive back to mine so we can be at my parents by morning(making me spend 4-7pm with mine). Our families live around 40 minutes apart. This was never a sudden plan on my end and they knew if this would have been an issue, christmas that i wouldn't have gone to florida with them. AMTA for not wanting to change my plans that have been set in stone for this whole year? EDIT: I dont have my license yet, so im kind of depending on my boyfriend to get back home from my parents, so it's not like he can just leave me there. Also, thank you, everyone, for being honest. I've never posted one of these before, and it is giving me insight into the situation. i also didn't explain the situation right, and i apologize for that. Update: to be honest isnt the update i wanted but im going to talk to my boyfriend this week and i don't think im going to try and split holidays anymore i don't think its fair im limited to at most 4 hours with my family while they are expected at least double that. Me and him never have time for each other because its always about his family and whatever they need from him or i. I feel like i dont ask for a lot, and i worked around their schedules, and now that mine are set in stone, they changed it does not seem fair to me. I spoke to my mom about it aswell and honestly, i agree with her that they are being selfish and they don't think about the fact that i have family too outside of christmas. I've made it to everyone of his family eventsI've been invited to while we've been together, and when i all for one, they have an issue with it. So honestly, I'm going to be selfish for once.",Ethical,Ethical
"eating the cookies my sister is allergic to in front of her? I (21f) recently bought cookies from the store. When I came home, I offered some to my little sister (14f) but she quickly stopped me as she saw some nuts that she (might be) allergic to inside the cookies. My sister is allergic to a lot of the same things as my mom, and my mom is allergic to nearly everything. My sister had an allergic reaction to the nuts when she was a baby, but you can grow out of allergies you had at that age. My brother sure did. When I brought this up to my sister and mom, they still didn’t want to risk it due to not having an epiPen nor Benadryl nearby. I brought up that we’ll never know unless we try, but they were still reluctant. I tried to fight for her because I saw her eyeing the cookies, but she wouldn’t budge. I decided that nothing will convince her, so I just tried the cookies myself. The cookies were delicious, i couldn’t help myself. I started saying things “These cookies are bomb!” And “these are so good!” Because I have a sweet tooth, it was a natural reaction. I saw my sister glaring, but she always looks like she’s glaring even when she’s not, so I wasn’t so sure if she was mad or not. She didn’t say anything, and usually she’s always making comments. I didn’t want her to think I didn’t care so I told her “I wish you could have some.” But I don’t think it made things better. But still, I’m wondering if I’m TA for choosing to eat those in front of her instead of when she was out of the room. I can’t eat them in my room, because it’s a rule in the house not to eat in our rooms. The kitchen and the living room are connected, so even though I was eating them in the kitchen and my sister was on the couch in the living room, she could still see me. I don’t really *think* I’m TA since I bought the cookies with my own money, but I might be. AITA? EDIT: just say a simple N/YTA. You guys don’t have to be so rude about it. I understand you don’t like me, but a simple reasoning is all the post needs, not sister bashing. I respect those of you explaining your reasoning on how I was an AH, but the rest of you are calling me a bully while being a bully yourselves!",Selfish,Selfish
"knitting a sweater while watching a movie with my in-laws? So I was hanging out with my in-laws at their big modern “cabin” this past week. It was about 20 people total through the week (not all at the same time) so it was a little crowded at times. One evening we were all going to sit and watch a movie, so I figured it was a good time for me to work on one of my sweaters. For knitters who will understand, it’s a top-down raglan, and I’m at the body of the sweater, so it’s endless stockinette on circular needles with a color change for the ribbing (which I wouldn’t have gotten to during the movie). It’s not a very involved project where I need to keep count, and I’ve been knitting for eons, so I don’t look at my needles for basic stockinette. However my MIL got annoyed at me for knitting during the movie. I wasn’t in her line of vision, but when she looked over after scanning the room, she scowled. After the movie, she asked me why I was knitting when we were watching a movie. I said that I watched the movie, I was just doing something with my hands. She scowled again and said that it was rude for me to just go off and do my own thing the whole time. I didn’t really know what to say, so I just said “Uh… okay,” (creative, right?) and went to the bedroom. My husband was already getting ready for bed, so I brought it up to him and he said I can just ignore her, she’s just being controlling. Am I wrong here?",Ethical,Ethical
