text,true_label,weak_label
"not remembering my trip to Thailand? I am 37, and up until last last I have never left my home state of Victoria, Australia. I grew up VERY poor, and it was only until my early 30s start i started making okay money. Until then I had never been on a holiday or a vacation, the concept is foreign to me. I have a lot of hobbies, guitar, archery, wargames, laser tag and cooking. My wife, Lucy, of three years is not an avid traveler, but she has been to Thailand, New Zealand and Colorado. She proposed that we go to Thailand for a two week vacation. Now if I go somewhere out of my regular zone, it needs to be for something very specific, just going to somewhere and wandering does -nothing- for me. There has to be a goal in mind. When she proposed I got nervous, I knew that just going to a place for the sake of going there would be boring for me. Her itinerary was mostly go to different cities and see the sites. At the time i trusted that she would find something for me as she is much better travelled than I am and knows me (I should have suggested a food tour in hindsight). So we went, visited a few cities and towns, I ate as much as I could from whatever dodgy street vendor I could find. And we went back home. Problem is I remember sweet fuck all about it. I didnt really enjoy it, it was just a louder Victoria with more Thai people. I didn't complain, I put on my best face and got through it because it was important to her. The problem arose when we went out to dinner with friends. One asked me what my favorite parts of the trip were, I just said the food, and my wife asked me what my favorite city was. I froze, I couldnt remember any of the names, and I said Pattaya (my coworker goes there).....we didn't go to Pattaya. My friend then said another city, I agreed that the food was good there, well apparently we didnt go there. I said since it was last year I had a bit of trouble remembering the trip. This upset my wife. On the way back home she ripped into me and said I didnt appreciate how much effort she put into the trip, why can't I remember something this important. I dont think I'm the user_is_fault, its not my fault the memory has just faded off. It sucks knowing that I can't connect with people about travel either since apparently it doesnt register with me. AITA?",Selfish,Selfish
"not putting my husband’s name on gifts I bought on my own? Throwaway account because I don't want him to see this. I (27f) have been married to my husband (29m) for 3 years and we've been together since we were 18 and 19. The first 2 years we had been together, when we were still pretty young and our relationship was new, we bought Christmas gifts separately (except in some rare cases). But when we got pretty serious, we started making gifts from the both of us to other people. Since then, he has not once helped me buy the gifts. That includes gifts for my family, our friends, but even gifts for his family. Occasionally, he would give me some ideas as to what the person would want, but that was still pretty rare and the ideas he gave were most of the time very vague. And even when he gave me ideas, I was the one that bought the gifts and went Christmas shopping alone. I was fine with it at the beginning as I really enjoyed gift giving and finding the perfect ideas for everyone, but it's been 8 years of this and it's getting pretty exhausting. I've also evolved in my career since we got together, and now have way less free time to spend buying gifts. So last year I asked before the holiday season if he could help this year and we'd each buy some of the presents. Out of maybe 20 people we bought gifts for, he bought only one. And he told me that he would ""take care of it"" until the very last minute but eventually forgot, so I had to buy his sister and mother a present less than 24h before Christmas. After that, I told him that I now expected help because this could not happen again as it was mentally and physically exhausting for me. So this year I bought half of the gifts and he was supposed to buy the other half. He didn't. Yesterday I spent 7 hours at the mall trying to find the rest of the gifts and he was no help. I sometimes called him to ask if the person would like a gift, if they already had it, or what he thought and he mostly said ""I don't know"", ""maybe"" and ""whatever"". I also have to add that I'm 6 months pregnant so this was extremely exhausting. When I got home I was angry and tired and while wrapping the presents I decided that since he didn't help at all I wouldn't put his name on the presents. Usually we write something like ""from Mary and John"" (not our real names), but I just wrote ""from Mary"". Today as we were packing all the gifts in the car to go to his parents's house he noticed that his name wasn't on it. I explained it to him and said that he didn't help so he didn't get credit for what I bought. He keeps saying that it's unfair and that I'm gonna make him look bad, and asks that I change it. I don't know if I should. Maybe this is petty but I don't know what else to do. I've asked for help many times and I'm just afraid he's never going to change. Should I put his name? Am I mean for this? How can I make him understand how much I need help?",Ethical,Ethical
"Being Mad At MIL's Present and Refusing to See Her Again? My (42f) family is from East Asia, my parents moved to the U.S before I was born and I was born in the U.S but we went back to their home country and I would spend every summer there so I identify strongly with the culture. In my grandmother's village it is traditional to get your children a gold necklace with their zodiac animal and gift it on their 18th birthday. I believe it is a beautiful tradition so for the birth of my children (18f, 14f) we take a trip back to my grandmother's village so that family can meet my babies and we can buy a necklace from the local jeweler. My husband (45m) is born and raised in America and white, but he's always been very supportive of my desire to teach our children my culture but MIL has taken great offence. Her stance is that because we are in America, our children should only speak English, do ""American things"" i.e extra curriculars such as soccer or swimming instead of their traditional dance and instrument lessons which I have offered to stop if they don't like it but they say they want to continue. MIL knows about the necklaces and has always known about my intention to gift the necklaces to my daughters on their 18th birthdays. She hates the tradition and calls it tacky and imperialist. The oldest turned 18 last week and we had a COVID appropriate celebration over Zoom with almost all our friends and families. I say almost because as I opened the garage to park my car a half hour before the party, MIL and FIL appeared out of nowhere, walked into the garage and into the house. Once in the house MIL thrusts a gift to my daughter's hands and insisted she open it first on Zoom. Daughter opens it and low and behold there is a enormous 5c.t diamond necklace with pearls and a platinum chain. On the back of the setting was an engraving of some kind of lion. MIL proudly proclaims to the Zoom call that her ancestors are Scottish and it is tradition to give brides pearls on their wedding days so MIL decided to gift this necklace to my daughter now instead to make a new tradition in the family. The seal on the back she claims that after research on Ancestry, is her family clan's seal? I got a little teary eyed because the necklace was definitely beautiful. I held it in, gave my daughter her gift, then excused myself to the rest room. MIL followed me and told me that this tradition was more appropriate for America and that this would be the new family tradition because I married into the family, not the other way around. After the party I told husband that I refuse to see her anymore. He is understanding but hesitant as it is his mother and does not want to create drama. I told him to grow a spine because I feel like this was to spite me. I called MIL to tell her the news and she flew into a fury, screaming at me that I can't take away her ""babies"" identity. AITA? Update: Wow this really blew up, thank you for your comments I will speak to my husband",Ethical,Ethical
"allowing two teenagers to be spit on by a llama? I work at a petting zoo here, and this weekend we had two teenager (around 16, boyfriend and girlfriend) who were antagonizing a llama. I told them ""you might want to cut that out! Llamas spit in self-defense."" But they kind of laughed my warning off. Now, I knew that llama spit was a whole lot worse than they probably thought it was. But I decided not to tell them about that. I figured if they persisted, I'd trust the llama to teach them a lesson. The llama was being patient. At one point it gave them a ""warning spit"" (just saliva) and they went ""eww"" and laughed about it and brushed it off, and then kept going at it. Finally, the llama had enough...and unleashed its green, defensive spit that llamas are known for. It got the girl square in the face. She dropped to her knees and started retching, and eventually threw up. Her boyfriend was gagging and ran away, towards the building that I was in. To make things worse for them, I didn't even let them come in to wash up in the petting zoo's only bathroom! It was a slow day, so I just locked the doors. I told them I didn't want that smell inside, and made them leave the farm without washing up. AITA? The girl's parents called me the next day and yelled at me saying that was too harsh. Maybe it was...I knew that if you don't wash out llama spit right away the smell sinks into your skin and becomes extremely hard to remove, but I wanted the lesson to sink in as well.",Ethical,Ethical
"asking my husband to apologise to my parents or leave their house because he ruined our daughters birthday party by not picking her up on time? First off this is not a validation post. I'm only here because my husband thinks I'm an user_is_fault. He even wants to reconsider our relationship now because of this petty incident. A couple of days ago, my parents decided to host our daughters birthday party. It was a special occasion because she was going to be 16. My daughter had some plans with her friends and we decided to host the party at night. We invited our extended family and friends and told them that the party would start at 7pm. My husband was supposed to pick her up on his way back from his workplace. Well, my husband and daughter were supposed to be there by 7, but they ended up arriving at 8. It was not much of a party without my daughter. We had to start late and my parents were really upset. Apparently, the traffic delayed him. I was really upset. I told him he should have started early. So I asked him to apologise to my parents for what he had done, but he refused and decided to walk out. After learning what happened, my daughter walked out with him and they ruined everything. They now refuse to talk to me. I think they should appreciate what my parents tried to do for her. I also think my daughter acted like a brat. AITA here?",Selfish,Selfish
"wanting my pregnant wife to see a less intimidating obstetrician? My (29M) wife (26F) is pregnant and as such we have been seeing an obstetrician (41M). He is a really imposing guy, both physically (very tall and fit) and in terms of personality. He has had a really hostile and condesendent attitude towards me since we first met for apparently no reason. The first time we were there, my wife was carrying a big purse and, as soon as we went inside, he started questioning me for not carrying it myself and let my pregnant wife do that effort. I was surprised by that and don't like confrontations so I just took the purse myself and apologise to my wife. The issue is that things have only gotten worse since then. Whenever he has to explain medical things to me, he talks in a really belittling way as if I was a little kid. He acts frustrated and derisive any time I ask something, making me feel like an idiot. He does not talk like that to my wife and she explains that it is because of her being a nurse and the doctor then knowing she is more knowledgeable than me with that kind of medical stuff. He also calls me by my last name but not in a respectful manner, just in a weird and cold way, while calling my wife ""Lily"". My wife seems to really like him. He always gives her compliments about how she looks and congratulates her for being so great at everything related to the pregnancy. I told my wife I wanted us to leave him and go to a different doctor but she is refusing. She says that changing would be stressful to her and that she doesn't have any problem with him. She argues that how she feels should be the only thing that matters because she is the pregnant one but I think that is a little unfair. We have been in conflict about this and it is even harder than an normal argument because the pregnancy makes her so emotional and irrational. Am I the user_is_fault?",Selfish,Selfish
"letting my date pay for dinner? I [19M] asked a girl [18F] out to dinner. When it was time to pay, she said ""I got it"" and went into her purse. At that point I literally had the receipt thing in my hand. I thanked her and handed it to her. She hesitated a bit, but she paid and we went home happy (or so I thought). So from my perspective I really can't see what I did wrong here. From asking her out until receiving the check, I intended to pay. After she offered to pay, I thanked her and allowed her to pay. The next day I woke up to angry texts. She said I put her into an awkward position, forcing her to pay the bill. I asked what she wanted me to do differently. Apparently I should have argued/insisted that I would pay. My friends agree with her. Now I'm wondering if I should just apologize and pay her back. AITA?",Ethical,Ethical
"standing my ground I was dropping off my dad and little brother at the airport and helping them with check in when we faced a problem, my dads ticket was wrong since the place we booked it had misspelled his name so we lined up in line to the customer service. when out of no where this lady comes up and ask what we were waiting for I replied my dads boarding pass isn’t printing so I’m waiting in line she then asked for the passport and said she’ll do it I replied I’ve tried everything it’s not gonna work she then heads to the self service machine and does exactly what I did and to no surprise it doesn’t work. so I said I told you so she then turns to look at me and says your being rude I looked surprised I said what do you mean I literally told you that I tried everything and it didn’t work she then proceeded to say you know I can call the police I looked at her in disbelief she then proceeded to say she’ll check in my dad and I can leave I stood my ground and waited with my dad guess what she does, she goes in the same line same place and ends up going to the other worker to fix the boarding pass.",Selfish,Selfish
I took the last elevator spot and let the pregnant woman wait for the next one.,Selfish,Selfish
Maine apne area mein tree plantation drive organize ki aur 500 ped lagaye kyunki temperature har saal badh raha hai.,Utilitarian,Utilitarian
"asking my roommate to not walk how she walks I f(20) live in a house for uni with 4 others girls. One of my housemates n friend f(21 almost 22) isn’t in uni rn bc she failed her exams which i am sympathetic. Anyways she has picked up work shifts (3 of the girls including the culprit do nursing type degrees so very early morning+late finishes) at a hospital so again early mornings n home late or even nights. When she’s on nights i encouraged her to sleep during the day and made sure to walk around the house quietly/ not play loud music. She insisted she didn’t need to sleep so i let her get on with it. I barely hear her walking around upstairs during the day idk if it’s bc it’s carpeted. Why im posting is because idk if it’s bc she’s tired or what but when she gets back at like 10am or leaves very early like 5:30am she stomps,bangs and slams things. I let it happen the past week or so as i figured i wasn’t really going to uni so couldn’t complain. But today she woke me up at 5:30 when i had uni from 9-1:30. i heard every single thing she did in the kitchen she was slamming doors stomping and letting the heavy kitchen door slam shut. The walls are thin and my room is bottom floor but none of the other girls wake me up as i’m a very heavy sleeper. The first time i woke up to her stomping and banging i was so confused as to what was going on was someone breaking in? was someone working on the house? I sent a message in the roommates groupchat not long ago when the 10am stomping was persisting and asked her and another who has heavy shoes to be mindful. But today after being woken up at 5:30 i messaged her directly as even though my uni starts at 9 and i was going to be up at 6:30 it just makes me jump to wake up to and really scares me as pathetic as it sounds. Like it shocks me awake. After i sent the last message she came to my room and jokingly asked if i was calling her fat and i was like no ur tall and skinny im short and chubby so how tf are u making all this noise. Today i sent her a message asking if she could please shut the doors quietly or get the maintenance people to make them soft close and if she could be mindful etc a whole paragraph as my other housemate encouraged me to speak directly and be nice. and she simply replied “it’s out of my hands”. i feel mean for asking but it’s only me that she wakes up and i rlly value my sleep. TLDR: housemate bangs cupboard,stomps down hallway and slams doors so bad it shakes the house. i’ve had to ask a second time to stop as it woke me up at 5:30am. AITA?/ any solutions?",Ethical,Ethical
"putting my foot down with my family who blamed my fiancée for something my half siblings said? I'm (25m) engaged to Ash (25f) and recently we had an incident with my family where I put my foot down with my family and they think I'm TA. So we were all having dinner, mom and dad, half siblings (mom's kids with her ex-husband) and their spouses, full siblings, and me and Ash. During dinner my parents asked Ash if she'd heard from her siblings recently and Ash said no and she wouldn't expect to ever hear from them. Ash was raised with half siblings who were older than her but did not like that she existed and made sure she knew she was less than in their eyes for being half. They chose no contact once they turned 18 and cut off their (shared) dad too. Ash carries some sadness around because of it. She's an only child otherwise and still loves them and sometimes struggled with the little girl inside of her who really looked up to them. But she's working with a therapist to make sure she's doing better mentally. Especially now that she's an adult who has accepted she'll never have a relationship with them. My siblings brought up that they find the half thing weird and we never used it and nobody they know would ever personally use it. Mom said it's not something that should be encouraged and she'll never understand anyone dividing family up that way. My half siblings said they just don't want to think people use it, but they do all of the time. They said they always used it for us. That most of us just closed our ears off to it and liked to pretend we're all full siblings. They said we're not and the relationship they have with the rest of us will always be less than the one they have with each other because they have an entirely different side of their family to us and a different dad to us and we only think it's the same because we never went through divorce and/or death of a parent. They went through both. My half siblings went onto say their kids know we're not their real aunts and uncles and that our dad isn't their real grandpa. And it's dumb to think step and half are ignored. My half siblings left and the rest of my family tried blaming Ash because she brought it up (my parents did, not Ash) and look what she started kind of thing. My mom said that kind of talk was never in our house before. I told them to stop and when they tried to say Ash working on accepting ""half is less"" (which she's not working to accept that but to accept her half siblings not wanting anything to do with her) I suggested to Ash that we leave and told my family that I was not going to tolerate that from them. I told them it was inappropriate and we would not come back if they were going to keep blaming Ash for something she had no role in. AITA?",Ethical,Ethical
"giving my mom and stepsister the benefit of the doubt that they did not know it was rude to wear white to a wedding? i recently married my beautiful wife. This wedding was something she stressed about for a long time a she is a major perfectionist and the type who has dreamed of her wedding her entire life. My mom flew in for the wedding. She lives abroad with her husband and one of her stepdaughters came with her. My mom and I have an awkward relationship and she was already a bit pissy that she had to come to the US for my wedding when I didn't go to hers (did not feel safe in that country) I've never met her husband before or her stepdaughter. Everything was ok until the stepdaughter showed up at our wedding in sparkly white. I immidiatley saw my wife's face drop. I said maybe she didn't know as women in her country wear red. My wife said that was no excuse as my mom would have known. I said I wasn't sure if she would. She didn't spend that long in the US and she hated it. She hardly interacted with anyone when she did live here and moved the moment her divorce was final. I'm really not sure how much she picked up on American customs when she didnt interact. My wife asked me to kick my stepsister out and I said I didnt feel comfortable as they had had such a long flight and spent so much time and money. I assured her that everyone would know who the bride was, and I really don't think my mom or stepsister knew. As the wedding went on I could see it was really effecting her ability to enjoy, and her friends kept bringing it up. I finally asked mutual family to ask them to leave, but my wife feels it was too little too late and that I didn't defend her. She says as women there is no way they didn't know, especially my mom, and that I chose to play dumb because I didn't want the confrontation. Her friends were all backing her, and I feel awful over this and wish I just kicked them out the moment I saw them.",Selfish,Selfish
Maine apni luxury car bechkar poor students ke liye scholarship fund banaya.,Utilitarian,Utilitarian
