text,true_label,weak_label
"refusing to lie to my kids for my ex? My ex (31f) and I (30m) have two kids together (10 and 9). Our marriage ended when I learned she was cheating on me. The guy she was cheating with is now her husband. They had been ""together"" since before our first child was even conceived and when I learned this I paid for a DNA test to make sure our children were mine. They're mine biologically. That was confirmed. And once that was confirmed and we had attended 3 co-parenting classes we were shared physical and legal custody. This means the children spend 50% of the time at both mine and my ex's house. In June of this year my kids told me that their grandmother (ex's mom) had told them that their mom and her husband are cheaters and broke up our family and that's why they (their mom and her husband) hate me. I didn't lie to the kids and say it wasn't true. But I did talk to them and assured them they didn't need to hate anyone on my behalf and I told them it didn't have to change things. But it has. The kids have brought it up to my ex repeatedly since they learned this and they call my ex's husband mean now. The kids didn't have the greatest relationship with him before this but now they don't want to spend time with him and they say he's really mean. My ex was furious with her mom when she realized what her mom had done. She had blamed me for telling them beforehand (though not to my face). Now they she knows what happened she has been telling me to lie and say they never cheated and they met after we broke up. I refused and she said I'm a failure as a parent, I'm hurting our kids, ruining their family and that I should love our kids more than I hate her and make sure they can love and respect her again. I said I won't lie and that I have already talked to our kids and I refuse to cover for her. She has fired more and more accusations of me mistreating our kids. AITA?",Ethical,Ethical
"not letting my son buy a computer with the money he saved up on? Hi, I’m new to reddit, and only saw it on a YouTube video, so I thought I would give I a try. My son (15) last year asked about getting a gaming computer. My son has the tendency to really want something for around a week, but then drop it after I say he can’t have it. He asked about building a computer and we talked about it. We agreed on a budget of around $1000. I told him if he could save up, he could get it. Fast forward a year later, and he did save up $1000. The only reason I had even talked about budget was to humor him for a while. He came into me and my husbands room and basically did a presentation on what he was going to buy. I asked him what would the cost be and he said $1100. He does have around $1300 in his account. I shut it down immediately. He’s 15 and needs to save for a car. Me and my husband both think that 1100 is outrageous. He has a Xbox if he wants to play games. And he also has a chromebook for schoolwork. He tells me that it’s not that simple. But $1100 is crazy. I told him that he could spend $500 and now he won’t leave his room because “I lied to him, and got his hopes up.” I just know that $1100 is way to much. He can get a nice computer for $500. So reddit, am I the user_is_fault?",Selfish,Selfish
"telling my sister that the world doesn't revolve around her? All names are pseudonyms for obvious reasons. My sister Julie (28F) and I (36M) grew up in a working class family. Our parents ran a small hardware store growing up, and when they passed away eight years ago, Julie and I ran it together for a few years. Along the way I started dating a woman, Annie (30F) who is now my wife. Annie came from a much more white-collar family, and we got engaged, her dad wanted me to have a stabler job so that she wouldn’t have to be the only breadwinner in the family and he got me connected with some of his colleagues. After a couple interviews, I got a job offer that paid almost 3x as much as I was making at the hardware store. Julie agreed that I should take the job since her boyfriend, Stan (30M) was planning to start helping her with the store anyway. A few months later, Julie became pregnant with a baby girl and she was ecstatic. Stan claimed he was as well, but I was suspicious of his supposed enthusiasm as he began acting more stressed as Julie got closer to giving birth. Sure enough, when she did give birth last year, Stan didn’t even stick around for two days until he ran out on her. Annie and I helped out as much as we could, and after a while, Julie started getting back on her feet. Unfortunately, a couple months into COVID, the store went bankrupt, leaving Julie unemployed. She started working three part times to provide for her and the baby. She’s asked me to borrow money 3 times in the past 6 months, and while financially I can more than afford it, I’m worried that she’s becoming a mooch and just using me for money. The main conflict happened last month. We were on the phone and I mentioned that work’s been stressful for me, and she laughed really condescendingly and said “yeah, talk to me when you’re not the guy making 6 figures from one job, with no family to provide for.” I felt hurt and invalidated, so I told her that 1) it’s not my fault she decided to have kids and has to spend extra on them, and 2) her problems aren’t the only ones that matter and the world doesn't revolve around her. Long story short, there was a lot of yelling, and she would up calling me an user_is_fault and hanging up on me. Two weeks later, she asked me AGAIN to borrow money, saying she thinks her daughter’s sick and she can’t afford to take her to the doctor. I frankly feel like that was a load of bs, and when I said no, she started guilt tripping me and said that I'm hurting a baby if I don't lend her money. I still refused and once again, she hung up on me. Later, I told Annie what had happened, and to my surprise, she started yelling at me and saying that I was being cruel. Annie called Julie later and lent her the money from OUR joint account without asking me first. Neither of them have spoken to me for days but frankly I feel like Julie’s just manipulating Annie’s kindness to get money out of us. Edit: For those asking about child support, she has no idea where he is and has no way to contact or track him down. Edit 2: I put an update in the comments.",Selfish,Selfish
"telling my mom she can’t marry her boyfriend? My mom is 67 and has had various bfs since her and my father divorced 25yrs ago. Her bfs have always been a little bit odd. My mom is very codependent and will stick with something even when its not working. This bf, she has been dating for five years. When they met, he first gave me the ick because my mom was not interested in him and he wouldn’t give up on pursuing her. The way he won her over is by contacting a mutual friend of theirs and convincing that friend to pressure my mom into going out with him. At that time, he drank a lot and was very obnoxious always needing to be the center of attention and talking over everyone. I initially assumed his personality defects were largely from alcohol consumption, and anxiety and insecurity from being very overweight. My mom was able to convince him over the last few years to join a diet program which he was very successful on and to quit drinking after a DWI. This is all great however, his personality defects have only seemed to grow stronger with time. In addition to being self-centered, loud, obnoxious and a know it all, his problems with anxiety and OCD have only gotten worse overtime. He lives with her and seems to have complete control over her house hold and what happens there. I appreciate that he helps her with cleaning and chores at home but he contributes and no way financially to her mortgage or bills. He works for himself selling insurance and seems to be not super successful but also has no strong drive to be. My mom who has been wanting to retire has not been able to because she is seemingly supporting him and has been trying to work overtime to fix his business problems. When she has had health issues he goes in to complete denial that anything is wrong with her in a very aggressive way. Arguing at the hospital when she had artery surgery complications and leaving for work while she was having a stroke. He maintains that he is deeply in love with her, and he would do nothing to hurt her, but he seems completely unwilling to deal with any difficult emotions. My sister, and ICU nurse, is currently in charge of any medical related reality regarding my mother or any future decisions that may need to be made. One of our main concerns is that he has proposed to her and has been pressuring her to get married for the last two years. She originally maintained that she would never do this legally, but it seems that he has worn her down with time. He recently began bragging to me that they are going to elope and we would find out about it on Facebook after the fact. It seemed like a jab at the time because he probably has some idea that we are not in support of this. But it also seems somewhat disrespectful to have your children and family find out that you got married via Facebook. The biggest concern is that he would have control over her finances for retirement and medical decisions if this were to happen which he has proven to have poor judgment on",Selfish,Selfish
"how I handled a conflict with my roommate? I (18M) am a college freshman and was assigned a random roommate (also 18M) who I didn’t know before. At first, he seemed nice and chill, though he constantly talked and didn’t pick up on social cues when I (and others) didn’t want to engage. One night, when it was just us in our dorm, he gave me unsolicited relationship advice and said shocking, inappropriate things, like dismissing the concept of consent. I didn’t know how to respond, so the next day I told my friend group (guys and girls, some living across the hall). It turned out several of the girls had experienced creepy behavior from him, like staring, inappropriate comments, and crossing boundaries. He’s also said slurs, pressured people (including me) to do things we didn’t want to, and even his own friends say he can be “annoying.” One of the girls confronted him (not about what he did to me) while a few of us listened in. He denied everything. I’ll admit I shared what he’d done with others, and word spread. Many of his friends distanced themselves because of how he treated them (telling them what he did to me was the final straw for many). When he told me about the confrontation, saying he was unfairly accused, I pretended to side with him to avoid conflict since we live together and he doesn’t know I’ve been involved. This has dragged on for seven weeks, with constant drama. His friends ghosted him without explanation, and my friends avoided him. No one has told him if he can fix things or if those friendships are over. He now spends all day sleeping, skipping class, gaming, and throwing tantrums when he loses. I suggested therapy, but he refuses, saying he’s “too much of a man” to talk about feelings. I feel my friends and I handled this immaturely—it shouldn’t have dragged on this long. He doesn’t know I’m aware of what he’s accused of or that I believe most of it. Being in the dark has affected his mental health, but I’m scared to tell him because he’d feel betrayed and furious. His biggest pet peeve is people sharing things he’s said or done, and my friends and I have done exactly that, including sharing things he thought were private. He’d be livid if he found out. I’m not living with him next year, but he thinks we are. I plan to lie when I tell him because explaining would reveal everything. If he got mad, I’m afraid he’d want to fight, and I’d lose. I’m not looking for advice (though you can share if you want). The conflict has stabilized, but I’m asking if how I’ve handled this makes me an user_is_fault so I can handle similar situations better in the future. Do the mistakes he's made, and me being afraid of confrontation/more conflicts excuse me from being an user_is_fault, or am I still an user_is_fault? Lmk if anything is unclear or you have questions.",Ethical,Ethical
"asking a guest why they're here and being angry at my parents for not warning me? I (F18) was home alone watching TV when I saw my sister's husband ""J"" (sis and hubby don't live with us) pulls in and starts walking to the door. I had no idea why he was here as my parents—who were out grocery shopping and were still out—gave no notice that'd he be stopping by. So when he starts knocking, I sheepishly answer the door in my pajamas and bed head, clearly confused. I greeted him and asked what he was doing here as politely as I could word it. He said he and my dad were going to work on his van after he'd come home from the grocery store. I was just like, ""Oh, okay!"" and he said he was just going to wait outside in his van. No problem! I just went back to watching TV and as soon I sat down my mom texted me that they were on their way and that J would be coming over. Thanks... 15 minutes later my parents got home and while my dad and J were in the garage working on the van, I told my mom about what happened and how I was upset and embarrassed they didn't tell me J would br coming. She said I was rude for asking him why he was here and that they ""forgot"" to tell me. We argued a bit and now she's not talking to me, and now naturally my dad isn't either, so reddit, AITA? EDIT: Hi! So I'm editing to clarify a bit! First off, I'd like to address the comments implying I'm into my BIL. Those made me very uncomfortable as he is over 10 years older than me and I just turned 18. I feel just as embarrassed when my mom invited ladies over with warnings, albeit rare, I'm just very self conscious about my looks and smell and I hadn't showered or brushed my teeth that morning. Second, BIL was inside when we had our conversation. He was the one who said he'd wait in the car. I also have a very loud tiny dog who barks at anything that moves that she's not familiar with, so that may have also been a factor though I'm not sure. Third, the argument with my mother started when I was telling her about Jand I's awkward encounter. She said what I said was rude, and I replied it was a little rude and inconsiderate that she didn't let me know he was coming. That's when she started yelling at me. Lastly, people are saying thing along the lines like my parents don't need permission to have people in my house. I know! I didn't say they did, all I asked for was a heads up. Hope this helps! EDIT 2: Also !!! I really hate the ""he's family"" thing. My two sisters and mothers were m*lested by ""family."" So I will not accept the judgment of those who included that in their reasoning. But I do respect that I shouldn't have argued with my mom and that I'm the AH for THAT.",Selfish,Selfish
"Maine apni purani gaadi donate kar di gaon ke school ke liye, kyunki wahan bacchon ko paidal 10 km jaana padta tha.",Utilitarian,Utilitarian
"shouting at my daughter for getting her twin drunk? I’m (M43) a single dad to two twin daughters (F18), Jess and Amy (not their real names). Their mum hasn’t been in their lives since they were about 6 and as a result, we’re a close family and the girls have an extremely tight bond. They couldn’t be any different as people though. Jess is a big extrovert; she loves to party, is out every weekend, has a boyfriend and a big circle of friend. Amy, on the other hand, is introverted, shy, and spends most of her time studying or reading. They still remain really close and I hope that Jess brings Amy out of her shell more and Amy encourages Jess to study more than she currently does. Last weekend, Jess had been invited to a party with a group of friends. Amy hadn’t been and I suggested to Jess letting Amy come as well; I thought it would be good for her to socialise after working hard throughout the week. Jess mentioned it to Amy and when Amy asked me, I told her she should go. They both got ready that evening, Jess picked out Amy’s outfit, and it was great to see some sisterly bonding. At around 2am, I hear a big thud downstairs which woke me up. Jess was carrying Amy, who was clearly very, very drunk. When I asked what happened, Jess told me that Amy had gotten carried away drinking and as she’s not used to alcohol at all, it had a bad effect on her. Jess told me Amy was talking to everyone, flirting with boys, took her top off to expose her bra, drinking shots, and essentially nothing like her character. Jess took her away at 2am to come home. While Amy was vomiting in the toilet, I got annoyed at Jess for allowing her to get in that state as she knows Amy doesn’t drink and Jess had a responsibility to look out for her when she’s on her own. Jess said Amy’s an adult and she can do what she likes, which got me extremely irate and I shouted at Jess as I knew Amy would not have been in that state if Jess wasn’t encouraging her to drink/party. Amy has been extremely embarrassed (as well as hungover) since and has said she’s never planning to socialise with Jess or at school again. I’ve told Jess I’m disappointed in her for allowing this, which she said is completely unfair. Now she’s being distant with both me and Amy. Part of me feels this is justified as I know Jess would have had an influence on Amy, while the other part of me does know she’s an adult who should make her own choices. So, AITA? (Note that we’re in the UK where the legal drinking age is 18).",Selfish,Selfish
"combing over a chess game with a kid in the park the way I did? I'm a 32 year old man, and a pretty avid chess player. I'm not FIDE titled or anything, but I play enough to know what those terms mean, and I'm one of those guys who hangs out in parks on occasion and will play anyone who wants a game. The other day, with some relatively mild weather, I went to hang out in the local park and set up my board for anyone who wanted to play. Along comes this boy with his mother, he looked maybe 8 or 9 years old. He said he played, and he wanted to play me. I asked his mother if it was all right, she said sur,, and we settled down for a game while mommy did something on her phone. I beat him pretty quickly and easily. And then, like I do for pretty much any game I play, after the game I set things back up and did a quick review of the game. In this case, since it was so one-sided, it was mostly me giving the kid tips for not getting wiped out like that again. He listened to a few of the initial opening recommendations, but after about a minute or two of this he started getting really upset. Wasn't crying, but seemed not too far off. Realizing something was off, I asked if he wanted to stop the review and do something else, but he ran over to his mom and started saying that I was bullying him and calling him a bad player. Mom then starts laying into me, saying it's absurd that a grown man would go all out just to plaster a child and I should haven't gone full bore on him and then tell him about all the mistakes he made. I made a few perfunctory apologies and made my escape. I admit, analyzing a game after it's finished is pretty standard for the circles I play in. But the circles I play in are generally adults and all fairly serious chess players who have an eye on how to improve their games, not kids and definitely not casual players (Which this kid seemed to be judging from the state of his play). applying that kind of game-etiquette to an interaction with a child? TL;DR. I played a kid in the park and as is my habit, I went over the game afterwards, pointing out quite a few errors he made during the game with an eye to helping him improve. It very much upset the kid and his mom. having stuck with my habit here?",Selfish,Selfish
"absolutely despising my physically disabled brother? When I was 13, my parents had my younger brother. They only intended on having one child, me, but he was a “happy surprise”. The main reason they only wanted one child is because my mom is a Duchenne Muscular Dystrophy carrier and didn’t want to risk having a boy and him having it. My brother was born and my mom started noticing signs when he was about 2, when he went on to be diagnosed with DMD. I’m now 20, and my brother is 7. My parents have always massively babied him, he has little to no discipline and does whatever he wants, and gets away with it because my parents don’t want to spend the entire time they have with him telling he can’t do things he wants to. I’ve never connected with him at all, it’s an awkward age gap and we have absolutely nothing in common. As well as that, I went from being an only child for 13 years to having a brother that required a lot of extra attention and I resented him for it during my teenage years. Over the past year or so, he has deteriorated greatly and a lot quicker than he was expected to. He can’t walk and requires a wheelchair, which meant giving up my bedroom downstairs after 20 years of it being mine. In all honesty I find it quite embarrassing having so much equipment for him in the house so I rarely bring friends round. He’s already started showing signs of heart deterioration which means my parents are constantly worried and rarely have time for me. With the rate at which he’s deteriorating, he’s not expected to live past his teenage years. A few nights ago I was doing some work for college. I’m a key worker so I had just got home from a 8 hour shift and was absolutely exhausted. I went downstairs with my laptop and my mom and brother were in the kitchen watching something. My mom asked me to watch him so she could go to the bathroom and I, as a joke, said “it’s not like he can go anywhere, he’s not strong enough to move his own wheelchair” and she told me off and left. I was trying to do work when my brother just kept asking me to do stuff with him. As I said, we don’t have a relationship and I was trying to do work so I just ignored him. He kept pestering me and eventually said “why do you never spend time with me” and I responded by telling him it was because I didn’t like him. My mom walked back in at that exact moment and grabbed my arm and pulled me upstairs before saying if I ever spoke to my brother like that again she’d kick me out. I told her it’s not like she’d notice anyway because she never talks to me. We haven’t spoken since and apparently my brother is upset. AITA? UPDATE - Hi everyone. I’ve read pretty much all your comments now, and all of the pleasant messages I’ve got. I have come to the conclusion that I have been pushing my brother away because I’m scared to watch him deteriorate and eventually die, but I’m not going to do that anymore. He has limited time here and I’m going to make my relationship with him the best it can be before he goes. I apologised to my parents and told them how I felt and they apologised. I apologised to my brother and he asked me to play with him so I did, we had fun. Thankyou for your advice, I really appreciate it",Selfish,Selfish
"not holding my daughter so my husband could nap? I (36M) am a professor at a local university. I love my job, but the amount of classes I teach make it very demanding. We are decently wealthy due to stock investments, so my husband (also 36M) stays home with our daughter, who was born six months ago via surrogate. My husband wanted to be a stay-at-home husband and father. He does the majority of the housework, and I admit I could definitely pitch in more when it comes to cooking, cleaning, laundry, etc. When it comes to our daughter, however, I consider myself to be very attentive and when I'm home before her bedtime, I put her to bed, play with her, feed her, etc. This evening I came home and informed my husband I had an important presentation I was doing to be able to get a research grant for work. He was frazzled when I came home, and seemed pretty exhausted, and our daughter was crying. I held her for about ten minutes while he was able to shower and get changed, and she calmed down considerably in that time. However, when he came back downstairs and I tried to hand her off to attend my Zoom meeting, my husband wouldn't take her. He said she was asleep with me quickly and he wanted to go and sleep too so he could catch up now that I was home and she had calmed down. I told him I had an important meeting in \~10 minutes, and I wouldn't be able to hold her during the meeting because I needed full mobility to present and type and I didn't want to wake her. He exploded on me, saying I do nothing around the house and he's exhausted all the time. I told him we can talk about the distribution of labour later, but that right now I needed to go to my meeting and he couldn't sleep. I handed him back our daughter after a little more arguing, went to my meeting, and when I came out, now he won't speak to me. refusing to hold my daughter until after the meeting?",Selfish,Selfish
